{
  "availability": "single-local-cell-no-sla",
  "checks": {
    "metrics": {
      "argv_sha256": "sha256:63f57ff9905f6a93052550b770bffeb04d699e4071324c324395ed6a7ab7757e",
      "output_bytes": 2268,
      "output_sha256": "sha256:4f190b3085ed28292b0bfab5e6662fc93f0588f93e2714cd60bb9f1c9d501bea",
      "status": "passed"
    },
    "process": {
      "argv_sha256": "sha256:ba7c1637fb6cf6bb134d1cb721cb783dbbcfacc379075f7afb1eca917616f10a",
      "output_bytes": 1050,
      "output_sha256": "sha256:b74948e140ce460a3075f77037a3e9ae21e894b4ad5d46385f6041ff4f3fb3f8",
      "status": "passed"
    },
    "sandbox": {
      "argv_sha256": "sha256:d82a4a25473133620e312b1f4c099ca15d65d2582a75888b5d29622437154213",
      "output_bytes": 1352,
      "output_sha256": "sha256:d731254fb096db2d977f933d16c9672f38ab1dc9fb7c8c28fc0ede3e0571415c",
      "status": "passed"
    },
    "workloads": {
      "argv_sha256": "sha256:4edf993f2c8d354d65d5a9fe278c9bdbc7cc49700f80f5de1dbe85d4a7f0954c",
      "output_bytes": 1661,
      "output_sha256": "sha256:b410de9776dc2d6daa000811527ef5d9bd860982d979ba086e97b064f4491892",
      "status": "passed"
    }
  },
  "cleanup": {
    "cell_root": "removed",
    "transient_units": "collected"
  },
  "cost": {
    "existing_host_cost": "unmeasured",
    "external_provider_spend": "none-authorized-or-incurred"
  },
  "format_version": 1,
  "host": {
    "apparmor": "registered-unproven",
    "architecture": "x86_64",
    "cgroup_v2": "available",
    "distribution": {
      "id": "ubuntu",
      "version": "24.04.4 LTS (Noble Numbat)",
      "version_id": "24.04"
    },
    "kernel": {
      "image_package_md5": "90a4202b3d270361346bf20f324d65b4",
      "license_document_sha256": "sha256:2464cf4959e6391dd238e2921d00d5bbc995f4f5a98434725985438ff70b7945",
      "package": "linux-image-7.0.0-28-generic",
      "package_manifest_sha256": "sha256:2a178058ccc97289e7fe0ed6c4a1c4f2c95861ae02aaabded9171c4ec1a08945",
      "package_source": "https://archive.ubuntu.com/ubuntu/dists/noble-updates/",
      "package_version": "7.0.0-28.28~24.04.1",
      "release": "7.0.0-28-generic",
      "running_notes_sha256": "sha256:452425484695151ba8de3716da09fb69aa7d798079aeac4a0ea76c788c3f8b94",
      "running_version_sha256": "sha256:3e63c1a05191d29c2b5631b08f3e91e1c605d1ac7a18ddd2d76aa0bb7370242a"
    },
    "psi": {
      "cpu": "available",
      "io": "available",
      "memory": "available"
    },
    "selinux": "unavailable",
    "tools": [
      {
        "binary_sha256": "sha256:52231e1caf55bcbc667b269f49c63599a6f7db4767ae6a039580d0ff853db712",
        "executable": "/usr/bin/bwrap",
        "license_document_sha256": "sha256:229a402fddba5c81005950f28de162359383cba731f5b859b8f82a03c338bf01",
        "package": "bubblewrap",
        "package_architecture": "amd64",
        "package_integrity": "verified",
        "package_manifest_sha256": "sha256:4e520d548034f13aad3a6e4fdabd745ec3f4095d9388f0e71fbca287f3e169c2",
        "package_source": "https://archive.ubuntu.com/ubuntu/dists/noble-updates/",
        "package_version": "0.9.0-1ubuntu0.1"
      },
      {
        "binary_sha256": "sha256:dbc8b988a849d5c9d7ef2de7068a6f107021bc6c11e0d7864c73f373eef726a7",
        "executable": "/usr/bin/systemd-run",
        "license_document_sha256": "sha256:a7d06854714a1ca99f6dbd1a1641dde5bcf28635be149f6554449618f8f427f3",
        "package": "systemd",
        "package_architecture": "amd64",
        "package_integrity": "verified",
        "package_manifest_sha256": "sha256:806aa11032406880521568ba587570d4c10e7abffe3743a6bfa022f8728db430",
        "package_source": "https://archive.ubuntu.com/ubuntu/dists/noble-updates/",
        "package_version": "255.4-1ubuntu8.17"
      },
      {
        "binary_sha256": "sha256:a431738fadddc2e2326c8ab81843e72f4011658379381aef1502a6ddb1c1115b",
        "executable": "/usr/bin/taskset",
        "license_document_sha256": "sha256:3492fb92cb56cf517d9a899828b4f989038421a38736e49e5525ffbd33196eab",
        "package": "util-linux",
        "package_architecture": "amd64",
        "package_integrity": "verified",
        "package_manifest_sha256": "sha256:aa27c3404d237e0f319b94cf6ce9c3aa03b6888ff2b0fb4b086d4a0bd745dea2",
        "package_source": "https://archive.ubuntu.com/ubuntu/dists/noble-updates/",
        "package_version": "2.39.3-9ubuntu6.6"
      }
    ],
    "virtualization": "none"
  },
  "isolation": {
    "asb_exclusive_lease": "passed",
    "credential_injection": "none",
    "network": "private-loopback-only",
    "persistent_runner_dispatch": "not-used",
    "transient_user_service": "passed"
  },
  "kind": "native-x86-capacity",
  "limitations": [
    "native-aarch64-unavailable",
    "not-a-performance-baseline",
    "not-for-public-pull-request-code",
    "apparmor-enforcement-unproven"
  ],
  "limits": {
    "cpu_quota_percent": 400,
    "memory_mib": 8192,
    "storage_mib": 16384,
    "tasks_max": 256,
    "timeout_seconds": 1200
  },
  "performance_baseline": false,
  "qualification": "native-functional",
  "run_id": "ubuntu-24-04-x86-64-native-functional",
  "source": {
    "base_commit": "72dd78f72dd74d20654232923dfe2fcff7771dff",
    "commit": "4658d0e1b600a8c8a792d9f2bd1f2f3c353ce740",
    "tree": "590fb49eba1a1d7861db47d78443a2d30e732358"
  }
}
